pregunta,respuesta
¿Qué es Tensorflow?,TensorFlow es una biblioteca de código abierto desarrollada por Google que se utiliza para tareas de aprendizaje automático y aprendizaje profundo. Está diseñada para realizar cálculos numéricos complejos utilizando grafos computacionales. A partir de la versión 2.0, TensorFlow introdujo varias mejoras, incluida la adopción del modo de ejecución "Eager" por defecto, lo que hace que el desarrollo con TensorFlow sea más interactivo y fácil de depurar. TensorFlow proporciona una API de alto nivel llamada Keras, que facilita la construcción, entrenamiento y evaluación de modelos de aprendizaje profundo. Keras se ha convertido en la interfaz recomendada para la construcción de redes neuronales en TensorFlow. Tiene una versión web llamada Tensorflow.js.
¿Qué es Tensorflow.js?,TensorFlow.js es una biblioteca de aprendizaje profundo desarrollada por Google que permite ejecutar modelos de TensorFlow en navegadores web y en Node.js. ensorFlow.js permite entrenar modelos de aprendizaje profundo directamente en el navegador utilizando la GPU del usuario a través de WebGL. Al tener un modelo en la nube, TensorFlow.js ofrece la capacidad de alojar y servir modelos en la nube para su uso en aplicaciones web. TensorFlow.js también es compatible con la mayoría de las operaciones y modelos de TensorFlow, lo que permite la interoperabilidad entre las dos bibliotecas.
¿Qué es PyTorch?,PyTorch es otra biblioteca de código abierto utilizada para tareas de aprendizaje automático y aprendizaje profundo. Es desarrollada principalmente por Facebook AI Research y se ha vuelto muy popular debido a su facilidad de uso y flexibilidad.\n\nLa librería ofrece un sistema de diferenciación automática que permite calcular gradientes automáticamente, lo que lo hace ideal para técnicas de optimización como el descenso de gradiente.\n\nTorchScript es una herramienta de PyTorch que permite compilar código de Python y modelos para mejorar el rendimiento y la portabilidad.
¿Qué es Scikit-learn?,Scikit-learn es una biblioteca de aprendizaje automático de código abierto basada en Python. Es muy popular entre los desarrolladores y científicos de datos debido a su facilidad de uso y su amplia gama de algoritmos y herramientas para diversas tareas de aprendizaje automático.
¿Qué es StackOverflow?,Stack Overflow es un sitio web de preguntas y respuestas sobre casi cualquier rama de la informática Lo interesante de StackOverflow es que si tienes una duda o problema solo debemos subirlo con el mayor detalle y descripción posible para que alguien pueda apoyarnos y darnos solución.
¿Qué es Figma?,Figma es una herramienta de diseño muy útil que tiene muchas ventajas, especialmente en términos de colaboración en equipo y versatilidad. Aunque tiene algunas limitaciones, sigue siendo una excelente opción para diseñadores y equipos de trabajo.
¿Qué es Discloud?,Discloud es un hosting de sitios web y bots de Discord, su idioma predeterminado es el portugués pero también soporta inglés. Según su sitio web tiene +50k deploys mensuales, +37k usuarios y +3684 bots/sitios web hospedados en él.
¿Qué es el canal DotCSV?,DotCSV es un canal relacionado al tema de inteligencia artificial, su creador es Carlos Santana, el canal se creó el 18 feb 2017 a YouTube y comenzó a subir vídeos hace 5 años con el vídeo "Lo que YA sabes sobre Inteligencia Artificial | DotCSV". Ahora sube vídeos relacionados a nuevos modelos de inteligencia artificial de Meta, OpenAI, clonación de voz con VoiceLab de ElevenLabs entre otros conceptos generales de inteligencia artificial como DeepMind. Su último vídeo es "LLAMA 2: La Revolución *OPEN SOURCE* de Meta contra ChatGPT".
¿Qué es discord.py?,Discord.py es una biblioteca de Python que permite interactuar con Discord a través de su API. Se puede instalar utilizando `pip install discord.py`. Discord es una aplicación de chat y voz muy popular utilizada principalmente por jugadores y comunidades en línea para mantenerse conectados y comunicarse mientras juegan o colaboran en diferentes proyectos de otros temas.
¿Qué es discord.js?,Discord.js es una biblioteca de NPM que permite interactuar con Discord a través de su API. Se puede instalar utilizando `npm install discord.py`. Discord es una aplicación de chat y voz muy popular utilizada principalmente por jugadores y comunidades en línea para mantenerse conectados y comunicarse mientras juegan o colaboran en diferentes proyectos de otros temas.
¿Qué es TypeScript?,TypeScript es un lenguaje de programación y superset para JavaScript desarrollado por Microsoft. TypeScript extiende y mejora las capacidades de JavaScript al agregar características adicionales y herramientas de desarrollo. La principal característica de TypeScript es la adición de un sistema de tipos estáticos opcional que permite a los desarrolladores especificar tipos a las variables, parámetros de función y valores de retorno entre otros.
¿Qué es JavaScript?,JavaScript es un lenguaje de programación de alto nivel, dinámico e interpretado, diseñado principalmente para agregar interactividad y funcionalidad a las páginas web. Es uno de los pilares fundamentales de la web junto con HTML (HyperText Markup Language) y CSS (Cascading Style Sheets). JavaScript permite a los desarrolladores crear contenido web interactivo y dinámico, lo que mejora la experiencia del usuario al permitir respuestas y acciones en tiempo real.\n\nAunque inicialmente fue concebido para uso exclusivo en navegadores web, JavaScript ha evolucionado y se ha expandido a otros ámbitos, como el desarrollo de aplicaciones móviles, servidores web (usando Node.js), aplicaciones de escritorio utilizando Electron.js o Tauri (con Rust) entre otros ámbitos. Es un lenguaje versátil y ampliamente utilizado en la industria.
¿Qué es Tauri?,Tauri es un conjunto de herramientas y marco de desarrollo de código abierto que se utiliza para crear aplicaciones de escritorio multiplataforma. Permite a los desarrolladores crear aplicaciones de escritorio utilizando tecnologías web como HTML, CSS y JavaScript (o sus variantes como TypeScript) y empaquetarlas como aplicaciones nativas para Windows, macOS y Linux. Para instalarlo puedes usar `npm create tauri-app` con NPM. Su ventaja es el rendimiento y la flexibilidad debido a que está escrito en Rust, a parte de poder programarlo con JavaScript o TypeScript, puedes acceder a funciones del sistema operativo utilizando archivos de Rust (.rs) o usando el paquete `@tauri-apps/apps`.\n\nEl 14 de junio de 2023 lanzaron la versión Tauri 1.4.0. Para actualizarlo puedes usar `npm install @tauri-apps/cli@latest @tauri-apps/api@latest`
¿Qué es R?,R es un lenguaje de programación y un entorno de desarrollo especialmente diseñado para la manipulación, análisis y visualización de datos. Es muy popular en el ámbito de la estadística, la ciencia de datos y la investigación científica. R es de código abierto, lo que significa que es gratuito y está respaldado por una comunidad activa de desarrolladores y usuarios que contribuyen con paquetes, funciones y mejoras constantemente.\n\nR cuenta con una amplia variedad de funciones y librerías dedicadas al análisis estadístico, lo que lo convierte en una herramienta poderosa para realizar tareas como regresiones, pruebas de hipótesis entre otros más.
¿Qué es Kaggle?,Kaggle es una plataforma que reúne a científicos de datos, ingenieros, investigadores y entusiastas del aprendizaje automático y la inteligencia artificial. Fue creada en 2010 y adquirida por Google en 2017. La plataforma se ha convertido en una de las comunidades más grandes y activas para compartir datos, competir en desafíos y mejorar habilidades en análisis de datos y aprendizaje automático.
