pregunta,respuesta
¿Quién eres?,¡Hola! Soy Thone AI ToRo, un modelo de inteligencia artificial desarrollado por Thone AI. ¿Qué necesitas? Estoy aquí para ayudarte.
¿Cuál es tu función?,Estoy aquí para responder preguntas y proporcionar información actual para ayudarte en tu día a día y facilitártelo. ¿Qué necesitas?
¿Quién ganó el último mundial?,El Mundial de 2022 se celebró en Qatar, donde Argentina se proclamó ganadora. Fue un partido emocionante y lleno de cambios, ya que Argentina estaba ganando 2-0 contra Francia, hasta que el jugador de la selección francesa, Kylian Mbappe, empató el partido en solo 2 minutos. Sin embargo, Argentina no se rindió y, tras un penalti provocado por el extremo derecho de la selección francesa, Ousmane Dembélé, Lionel Messi marcó el 3-2 a favor de Argentina en el minuto 107. Pero Kylian Mbappe marcó de penalti en el minuto 117, logrando un hat-trick y empatando el marcador nuevamente.\n\nLuego llegó la tanda de penaltis, donde la selección Argentina marcó 4-2 contra la selección Francesa, proclamándose campeona del Mundial Qatar 2022 y llevándose su tercer título mundial.
¿Cómo es tu nombre?,Me llamo Thone AI ToRo.
¿Cúal es tu nombre?,Me llamo Thone AI ToRo.
¿Cómo es tu apellido?,No tengo apellido, soy Thone AI ToRo.
¿Cuál es tu apellido?,No tengo apellido, soy Thone AI ToRo.
¿Qué es Thone AI?,Thone AI es un proyecto de inteligencia artificial fundado por 2 personas: Álvaro 842 y DisamDev en enero de 2023 con modelos open-source como ToRo, el cuál se encuentra actualmente en su primera versión llamada 'ToRo-1'. Este proyecto se centra en llevar la AI al siguiente nivel y que esté disponible para todos.
¿Cuál es la capital de Afganistán?,La capital de Afganistán es Kabul.
¿Cuál es la capital de Albania?,La capital de Albania es Tirana.
¿Cuál es la capital de Angola?,La capital de Angola es Luanda.
¿Cuál es la capital de Antigua y Barbuda?,La capital de Antigua y Barbuda es Saint John's.
¿Cuál es la capital de Arabia Saudita?,La capital de Arabia Saudita es Riad.
¿Cuál es la capital de Argelia?,La capital de Argelia es Argel.
¿Cuál es la capital de Armenia?,La capital de Armenia es Ereván.
¿Cuál es la capital de Australia?,La capital de Australia es Canberra.
¿Cuál es la capital de Austria?,La capital de Austria es Viena.
¿Cuál es la capital de Bangladés?,La capital de Bangladés es Daca.
¿Cuál es la capital de Barbados?,La capital de Barbados es Bridgetown.
¿Cuál es la capital de Baréin?,La capital de Baréin es Manama.
¿Cuál es la capital de Bélgica?,La capital de Bélgica es Bruselas.
¿Cuál es la capital de Benín?,La capital de Benín es Porto Novo.
¿Cuál es la capital de Birmania (Myanmar)?,La capital de Birmania (Myanmar) es Naipyidó.
¿Cuál es la capital de Bolivia?,La capital de Bolivia es Sucre.
¿Cuál es la capital de Botsuana?,La capital de Botsuana es Gaborone.
¿Cuál es la capital de Bulgaria?,La capital de Bulgaria es Sofía.
¿Cuál es la capital de Burkina Faso?,La capital de Burkina Faso es Uagadugú.
¿Cuál es la capital de Burundi?,La capital de Burundi es Bujumbura.
¿Cuál es la capital de Bután?,La capital de Bután es Thimphu.
¿Cuál es la capital de Cabo Verde?,La capital de Cabo Verde es Praia.
¿Cuál es la capital de Camerún?,La capital de Camerún es Yaundé.
¿Cuál es la capital de Canadá?,La capital de Canadá es Ottawa.
¿Cuál es la capital de Catar?,La capital de Catar es Doha.
¿Cuál es la capital de Chad?,La capital de Chad es Yamena.
¿Cuál es la capital de Chipre?,La capital de Chipre es Nicosia.
¿Cuál es la capital de Comoras?,La capital de Comoras es Moroni.
¿Cuál es la capital de Corea del Norte?,La capital de Corea del Norte es Pionyang.
¿Cuál es la capital de Corea del Sur?,La capital de Corea del Sur es Seúl.
¿Cuál es la capital de Costa Rica?,La capital de Costa Rica es San José.
¿Cuál es la capital de Croacia?,La capital de Croacia es Zagreb.
¿Cuál es la capital de Cuba?,La capital de Cuba es La Habana.
¿Cuál es la capital de Dominica?,La capital de Dominica es Roseau.
¿Cuál es la capital de Egipto?,La capital de Egipto es El Cairo.
¿Cuál es la capital de El Salvador?,La capital de El Salvador es San Salvador.
¿Cuál es la capital de Emiratos Árabes Unidos?,La capital de Emiratos Árabes Unidos es Abu Dabi.
¿Cuál es la capital de Eritrea?,La capital de Eritrea es Asmara.
¿Cuál es la capital de Eslovaquia?,La capital de Eslovaquia es Bratislava.
¿Cuál es la capital de España?,La capital de España es Madrid.
¿Cuál es la capital de Estonia?,La capital de Estonia es Tallin.
¿Cuál es la capital de Eswatini (Suazilandia)?,La capital de Eswatini (Suazilandia) es Lobamba.
¿Cuál es la capital de Etiopía?,La capital de Etiopía es Adís Abeba.
¿Cuál es la capital de Fiyi?,La capital de Fiyi es Suva.
¿Cuál es la capital de Finlandia?,La capital de Finlandia es Helsinki.
¿Cuál es la capital de Gambia?,La capital de Gambia es Banjul.
¿Cuál es la capital de Georgia?,La capital de Georgia es Tiflis.
¿Cuál es la capital de Ghana?,La capital de Ghana es Acra.
¿Cuál es la capital de Guatemala?,La capital de Guatemala es Ciudad de Guatemala.
¿Cuál es la capital de Guinea?,La capital de Guinea es Conakry.
¿Cuál es la capital de Guinea-Bisáu?,La capital de Guinea-Bisáu es Bissau.
¿Cuál es la capital de Guinea Ecuatorial?,La capital de Guinea Ecuatorial es Malabo.
¿Cuál es la capital de Guyana?,La capital de Guyana es Georgetown.
¿Cuál es la capital de Haití?,La capital de Haití es Puerto Príncipe.
¿Cuál es la capital de Honduras?,La capital de Honduras es Tegucigalpa.
¿Cuál es la capital de Hungría?,La capital de Hungría es Budapest.
¿Cuál es la capital de India?,La capital de India es Nueva Delhi.
¿Cuál es la capital de Indonesia?,La capital de Indonesia es Yakarta.
¿Cuál es la capital de Iraq?,La capital de Iraq es Bagdad.
¿Cuál es la capital de Irán?,La capital de Irán es Teherán.
¿Cuál es la capital de Irlanda?,La capital de Irlanda es Dublín.
¿Cuál es la capital de Islandia?,La capital de Islandia es Reikiavik.
¿Cuál es la capital de Islas Marshall?,La capital de Islas Marshall es Majuro.
¿Cuál es la capital de Islas Salomón?,La capital de Islas Salomón es Honiara.
¿Cuál es la capital de Israel?,La capital de Israel es Jerusalén.
¿Cuál es la capital de Jamaica?,La capital de Jamaica es Kingston.
¿Cuál es la capital de Japón?,La capital de Japón es Tokio.
¿Cuál es la capital de Jordania?,La capital de Jordania es Amán.
¿Cuál es la capital de Kazajistán?,La capital de Kazajistán es Nursultán.
¿Cuál es la capital de Kenia?,La capital de Kenia es Nairobi.
¿Cuál es la capital de Kirguistán?,La capital de Kirguistán es Biskek.
¿Cuál es la capital de Kiribati?,La capital de Kiribati es Tarawa.
¿Cuál es la capital de Kuwait?,La capital de Kuwait es Kuwait.
¿Cuál es la capital de Laos?,La capital de Laos es Vientián.
¿Cuál es la capital de Lesoto?,La capital de Lesoto es Maseru.
¿Cuál es la capital de Letonia?,La capital de Letonia es Riga.
¿Cuál es la capital de Líbano?,La capital de Líbano es Beirut.
¿Cuál es la capital de Liberia?,La capital de Liberia es Monrovia.
¿Cuál es la capital de Libia?,La capital de Libia es Trípoli.
¿Cuál es la capital de Liechtenstein?,La capital de Liechtenstein es Vaduz.
¿Cuál es la capital de Lituania?,La capital de Lituania es Vilna.
¿Cuál es la capital de Luxemburgo?,La capital de Luxemburgo es Luxemburgo.
¿Cuál es la capital de Madagascar?,La capital de Madagascar es Antananarivo.
¿Cuál es la capital de Malasia?,La capital de Malasia es Kuala Lumpur.
¿Cuál es la capital de Malaui?,La capital de Malaui es Lilongüe.
¿Cuál es la capital de Maldivas?,La capital de Maldivas es Malé.
¿Cuál es la capital de Malta?,La capital de Malta es La Valeta.
¿Cuál es la capital de Mongolia?,La capital de Mongolia es Ulán Bator.
¿Cuál es la capital de Mozambique?,La capital de Mozambique es Maputo.
¿Cuál es la capital de Namibia?,La capital de Namibia es Windhoek.
¿Cuál es la capital de Nepal?,La capital de Nepal es Katmandú.
¿Cuál es la capital de Nicaragua?,La capital de Nicaragua es Managua.
¿Cuál es la capital de Noruega?,La capital de Noruega es Oslo.
¿Cuál es la capital de Nueva Zelanda?,La capital de Nueva Zelanda es Wellington.
¿Cuál es la capital de Omán?,La capital de Omán es Mascate.
¿Cuál es la capital de Palaos?,La capital de Palaos es Ngerulmud.
¿Cuál es la capital de Panamá?,La capital de Panamá es Ciudad de Panamá.
¿Cuál es la capital de Papúa Nueva Guinea?,La capital de Papúa Nueva Guinea es Port Moresby.
¿Cuál es la capital de Paraguay?,La capital de Paraguay es Asunción.
¿Cuál es la capital de Perú?,La capital de Perú es Lima.
¿Cuál es la capital de Polonia?,La capital de Polonia es Varsovia.
¿Cuál es la capital de República Centroafricana?,La capital de República Centroafricana es Bangui.
¿Cuál es la capital de República Checa?,La capital de República Checa es Praga.
¿Cuál es la capital de República Democrática del Congo?,La capital de República Democrática del Congo es Kinshasa.
¿Cuál es la capital de República Dominicana?,La capital de República Dominicana es Santo Domingo.
¿Cuál es la capital de Ruanda?,La capital de Ruanda es Kigali.
¿Cuál es la capital de Rumanía?,La capital de Rumanía es Bucarest.
¿Cuál es la capital de Rusia?,La capital de Rusia es Moscú.
¿Cuál es la capital de Samoa?,La capital de Samoa es Apia.
¿Cuál es la capital de San Cristóbal y Nieves?,La capital de San Cristóbal y Nieves es Basseterre.
¿Cuál es la capital de San Marino?,La capital de San Marino es San Marino.
¿Cuál es la capital de San Vicente y las Granadinas?,La capital de San Vicente y las Granadinas es Kingstown.
¿Cuál es la capital de Santa Lucía?,La capital de Santa Lucía es Castries.
¿Cuál es la capital de Santo Tomé y Príncipe?,La capital de Santo Tomé y Príncipe es Santo Tomé.
¿Cuál es la capital de Senegal?,La capital de Senegal es Dakar.
¿Cuál es la capital de Serbia?,La capital de Serbia es Belgrado.
¿Cuál es la capital de Seychelles?,La capital de Seychelles es Victoria.
¿Cuál es la capital de Sierra Leona?,La capital de Sierra Leona es Freetown.
¿Cuál es la capital de Singapur?,La capital de Singapur es Singapur.
¿Cuál es la capital de Siria?,La capital de Siria es Damasco.
¿Cuál es la capital de Somalia?,La capital de Somalia es Mogadiscio.
¿Cuál es la capital de Sri Lanka?,La capital de Sri Lanka es Sri Jayawardenapura Kotte.
¿Cuál es la capital de Sudáfrica?,La capital de Sudáfrica es Pretoria (administrativa), Bloemfontein (judicial), Ciudad del Cabo (legislativa).
¿Cuál es la capital de Sudán?,La capital de Sudán es Jartum.
¿Cuál es la capital de Sudán del Sur?,La capital de Sudán del Sur es Yuba.
¿Cuál es la capital de Suecia?,La capital de Suecia es Estocolmo.
¿Cuál es la capital de Suiza?,La capital de Suiza es Berna.
¿Cuál es la capital de Surinam?,La capital de Surinam es Paramaribo.
¿Cuál es la capital de Tailandia?,La capital de Tailandia es Bangkok.
¿Cuál es la capital de Tanzania?,La capital de Tanzania es Dodoma.
¿Cuál es la capital de Tayikistán?,La capital de Tayikistán es Dusambé.
¿Cuál es la capital de Timor Oriental?,La capital de Timor Oriental es Dili.
¿Cuál es la capital de Togo?,La capital de Togo es Lomé.
¿Cuál es la capital de Tonga?,La capital de Tonga es Nukualofa.
¿Cuál es la capital de Trinidad y Tobago?,La capital de Trinidad y Tobago es Puerto España.
¿Cuál es la capital de Túnez?,La capital de Túnez es Túnez.
¿Cuál es la capital de Turkmenistán?,La capital de Turkmenistán es Asjabad.
¿Cuál es la capital de Turquía?,La capital de Turquía es Ankara.
¿Cuál es la capital de Tuvalu?,La capital de Tuvalu es Funafuti.
¿Cuál es la capital de Ucrania?,La capital de Ucrania es Kiev.
¿Cuál es la capital de Uganda?,La capital de Uganda es Kampala.
¿Cuál es la capital de Uruguay?,La capital de Uruguay es Montevideo.
¿Cuál es la capital de Uzbekistán?,La capital de Uzbekistán es Tashkent.
¿Cuál es la capital de Vanuatu?,La capital de Vanuatu es Port Vila.
¿Cuál es la capital de Vaticano?,La capital de Vaticano es Ciudad del Vaticano.
¿Cuál es la capital de Venezuela?,La capital de Venezuela es Caracas.
¿Cuál es la capital de Vietnam?,La capital de Vietnam es Hanói.
¿Cuál es la capital de Yemen?,La capital de Yemen es Saná.
¿Cuál es la capital de Yibuti?,La capital de Yibuti es Yibuti.
¿Cuál es la capital de Zambia?,La capital de Zambia es Lusaka.
¿Cuál es la capital de Zimbabue?,La capital de Zimbabue es Harare.
¿Cuál es la capital de Albania?,La capital de Albania es Tirana.
¿Cuál es la capital de Alemania?,La capital de Alemania es Berlín.
¿Cuál es la capital de Andorra?,La capital de Andorra es Andorra la Vella.
¿Cuál es la capital de Antigua y Barbuda?,La capital de Antigua y Barbuda es Saint John's.
¿Cuál es la capital de Argelia?,La capital de Argelia es Argel.
¿Cuál es la capital de Argentina?,La capital de Argentina es Buenos Aires.
¿Cuál es la capital de Azerbaiyán?,La capital de Azerbaiyán es Bakú.
¿Cuál es la capital de Bahamas?,La capital de Bahamas es Nasáu.
¿Cuál es la capital de Barbados?,La capital de Barbados es Bridgetown.
¿Cuál es la capital de Baréin?,La capital de Baréin es Manama.
¿Cuál es la capital de Bélgica?,La capital de Bélgica es Bruselas.
¿Cuál es la capital de Belice?,La capital de Belice es Ciudad de Belice.
¿Cuál es la capital de Bielorrusia?,La capital de Bielorrusia es Minsk.
¿Cuál es la capital de Bolivia?,La capital de Bolivia es Sucre.
¿Cuál es la capital de Bosnia y Herzegovina?,La capital de Bosnia y Herzegovina es Sarajevo.
¿Cuál es la capital de Brasil?,La capital de Brasil es Brasilia.
¿Cuál es la capital de Brunéi?,La capital de Brunéi es Bandar Seri Begawan.
¿Cuál es la capital de Bulgaria?,La capital de Bulgaria es Sofía.
¿Cuál es la capital de Camboya?,La capital de Camboya es Phnom Penh.
¿Cuál es la capital de Camerún?,La capital de Camerún es Yaundé.
¿Cuál es la capital de Catar?,La capital de Catar es Doha.
¿Cuál es la capital de Qatar?,La capital de Qatar es Doha.
¿Cuál es la capital de Chile?,La capital de Chile es Santiago de Chile.
¿Cuál es la capital de China?,La capital de China es Pekín.
¿Cuál es la capital de Colombia?,La capital de Colombia es Bogotá.
¿Cuál es la capital de Costa de Marfil?,La capital de Costa de Marfil es Yamusukro.
¿Cuál es la capital de Costa Rica?,La capital de Costa Rica es San José.
¿Cuál es la capital de Croacia?,La capital de Croacia es Zagreb.
¿Cuál es la capital de Cuba?,La capital de Cuba es La Habana.
¿Cuál es la capital de Dinamarca?,La capital de Dinamarca es Copenhague.
¿Cuál es la capital de Dominica?,La capital de Dominica es Roseau.
¿Cuál es la capital de Ecuador?,La capital de Ecuador es Quito.
¿Cuál es la capital de Egipto?,La capital de Egipto es El Cairo.
¿Cuál es la capital de El Salvador?,La capital de El Salvador es San Salvador.
¿Cuál es la capital de Eritrea?,La capital de Eritrea es Asmara.
¿Cuál es la capital de Eslovenia?,La capital de Eslovenia es Liubliana.
¿Cuál es la capital de España?,La capital de España es Madrid.
¿Cuál es la capital de Estados Unidos?,La capital de Estados Unidos es Washington D. C..
¿Cuál es la capital de Estonia?,La capital de Estonia es Tallin.
¿Cuál es la capital de Eswatini (Suazilandia)?,La capital de Eswatini (Suazilandia) es Lobamba.
¿Cuál es la capital de Etiopía?,La capital de Etiopía es Adís Abeba.
¿Cuál es la capital de Fiyi?,La capital de Fiyi es Suva.
¿Cuál es la capital de Filipinas?,La capital de Filipinas es Manila.
¿Cuál es la capital de Francia?,La capital de Francia es París.
¿Cuál es la capital de Gabón?,La capital de Gabón es Libreville.
¿Cuál es la capital de Georgia?,La capital de Georgia es Tiflis.
¿Cuál es la capital de Ghana?,La capital de Ghana es Acra.
¿Cuál es la capital de Granada?,La capital de Granada es Saint George's.
¿Cuál es la capital de Grecia?,La capital de Grecia es Atenas.
¿Cuál es la capital de Guatemala?,La capital de Guatemala es Ciudad de Guatemala.
¿Cuál es la capital de Guinea?,La capital de Guinea es Conakry.
¿Cuál es la capital de Guinea-Bisáu?,La capital de Guinea-Bisáu es Bissau.
¿Cuál es la capital de Guinea Ecuatorial?,La capital de Guinea Ecuatorial es Malabo.
¿Cuál es la capital de Guyana?,La capital de Guyana es Georgetown.
¿Cuál es la capital de Haití?,La capital de Haití es Puerto Príncipe.
¿Cuál es la capital de Honduras?,La capital de Honduras es Tegucigalpa.
¿Cuál es la capital de Hungría?,La capital de Hungría es Budapest.
¿Cuál es la capital de India?,La capital de India es Nueva Delhi.
¿Cuál es la capital de Indonesia?,La capital de Indonesia es Yakarta.
¿Cuál es la capital de Iraq?,La capital de Iraq es Bagdad.
¿Cuál es la capital de Irán?,La capital de Irán es Teherán.
¿Cuál es la capital de Irlanda?,La capital de Irlanda es Dublín.
¿Cuál es la capital de Islas Marshall?,La capital de Islas Marshall es Majuro.
¿Cuál es la capital de Islas Salomón?,La capital de Islas Salomón es Honiara.
¿Cuál es la capital de Israel?,La capital de Israel es Jerusalén.
¿Cuál es la capital de Italia?,La capital de Italia es Roma.
¿Cuál es la capital de Jamaica?,La capital de Jamaica es Kingston.
¿Cuál es la capital de Japón?,La capital de Japón es Tokio.
¿Cuál es la capital de Jordania?,La capital de Jordania es Amán.
¿Cuál es la capital de Kazajistán?,La capital de Kazajistán es Nursultán.
¿Cuál es la capital de Kenia?,La capital de Kenia es Nairobi.
¿Cuál es la capital de Kirguistán?,La capital de Kirguistán es Biskek.
¿Cuál es la capital de Kiribati?,La capital de Kiribati es Tarawa.
¿Cuál es la capital de Kuwait?,La capital de Kuwait es Kuwait.
¿Cuál es la capital de Laos?,La capital de Laos es Vientián.
¿Cuál es la capital de Lesoto?,La capital de Lesoto es Maseru.
¿Cuál es la capital de Letonia?,La capital de Letonia es Riga.
¿Cuál es la capital de Líbano?,La capital de Líbano es Beirut.
¿Cuál es la capital de Liberia?,La capital de Liberia es Monrovia.
¿Cuál es la capital de Libia?,La capital de Libia es Trípoli.
¿Cuál es la capital de Liechtenstein?,La capital de Liechtenstein es Vaduz.
¿Cuál es la capital de Lituania?,La capital de Lituania es Vilna.
¿Cuál es la capital de Luxemburgo?,La capital de Luxemburgo es Luxemburgo.
¿Cuál es la capital de Macedonia del Norte?,La capital de Macedonia del Norte es Skopie.
¿Cuál es la capital de Madagascar?,La capital de Madagascar es Antananarivo.
¿Cuál es la capital de Malasia?,La capital de Malasia es Kuala Lumpur.
¿Cuál es la capital de Malaui?,La capital de Malaui es Lilongüe.
¿Cuál es la capital de Maldivas?,La capital de Maldivas es Malé.
¿Cuál es la capital de Malí?,La capital de Malí es Bamako.
¿Cuál es la capital de Malta?,La capital de Malta es La Valeta.
¿Cuál es la capital de Marruecos?,La capital de Marruecos es Rabat.
¿Cuál es la capital de Mauricio?,La capital de Mauricio es Port Louis.
¿Cuál es la capital de Mauritania?,La capital de Mauritania es Nuakchot.
¿Cuál es la capital de México?,La capital de México es Ciudad de México.
¿Cuál es la capital de Micronesia?,La capital de Micronesia es Palikir.
¿Cuál es la capital de Moldavia?,La capital de Moldavia es Chisináu.
¿Cuál es la capital de Mónaco?,La capital de Mónaco es Mónaco.
¿Cuál es la capital de Mongolia?,La capital de Mongolia es Ulán Bator.
¿Cuál es la capital de Montenegro?,La capital de Montenegro es Podgorica.
¿Cuál es la capital de Mozambique?,La capital de Mozambique es Maputo.
¿Cuál es la capital de Namibia?,La capital de Namibia es Windhoek.
¿Cuál es la capital de Nauru?,La capital de Nauru es Yaren.
¿Cuál es la capital de Nepal?,La capital de Nepal es Katmandú.
¿Cuál es la capital de Níger?,La capital de Níger es Niamey.
¿Cuál es la capital de Nigeria?,La capital de Nigeria es Abuya.
¿Cuál es la capital de Nueva Zelanda?,La capital de Nueva Zelanda es Wellington.
¿Cuál es la capital de Países Bajos (Holanda)?,La capital de Países Bajos (Holanda) es Ámsterdam.
¿Cuál es la capital de Pakistán?,La capital de Pakistán es Islamabad.
¿Cuál es la capital de Panamá?,La capital de Panamá es Ciudad de Panamá.
¿Cuál es la capital de Papúa Nueva Guinea?,La capital de Papúa Nueva Guinea es Port Moresby.
¿Cuál es la capital de Paraguay?,La capital de Paraguay es Asunción.
¿Cuál es la capital de Polonia?,La capital de Polonia es Varsovia.
¿Cuál es la capital de Portugal?,La capital de Portugal es Lisboa.
¿Cuál es la capital de Reino Unido?,La capital de Reino Unido es Londres.
¿Cuál es la capital de República Centroafricana?,La capital de República Centroafricana es Bangui.
¿Cuál es la capital de República Checa?,La capital de República Checa es Praga.
¿Cuál es la capital de República del Congo?,La capital de República del Congo es Brazzaville.
¿Qué está pasando con la guerra de Ucrania?,La invasión de Rusia a Ucrania ha dado lugar a ataques indiscriminados contra zonas residenciales, escuelas, hospitales, infraestructuras sociales y otros objetos e infraestructuras civiles, y ha provocado muertos y heridos entre la población civil. Además, se están produciendo desplazamientos masivos y la destrucción de viviendas civiles.\nRusia también ha empleado bombas no guiadas, como las que mataron en marzo de 2022 a casi 50 personas que hacían cola para conseguir alimentos en Chernígov y armas prohibidas, como municiones de racimo, utilizadas al menos contra un jardín de infancia de Ojtirka donde se refugiaban civiles. Estos ataques pueden constituir crímenes de guerra.\nEn paralelo a la invasión de Ucrania, las autoridades rusas han desatado una oleada de represión sin precedentes en todo el país contra el periodismo independiente, las protestas contra la guerra y cualquier voz contraria a la invasión rusa de Ucrania.
¿Qué está pasando con la guerra de Rusia?,La invasión de Rusia a Ucrania ha dado lugar a ataques indiscriminados contra zonas residenciales, escuelas, hospitales, infraestructuras sociales y otros objetos e infraestructuras civiles, y ha provocado muertos y heridos entre la población civil. Además, se están produciendo desplazamientos masivos y la destrucción de viviendas civiles.\nRusia también ha empleado bombas no guiadas, como las que mataron en marzo de 2022 a casi 50 personas que hacían cola para conseguir alimentos en Chernígov y armas prohibidas, como municiones de racimo, utilizadas al menos contra un jardín de infancia de Ojtirka donde se refugiaban civiles. Estos ataques pueden constituir crímenes de guerra.\nEn paralelo a la invasión de Ucrania, las autoridades rusas han desatado una oleada de represión sin precedentes en todo el país contra el periodismo independiente, las protestas contra la guerra y cualquier voz contraria a la invasión rusa de Ucrania.
¿Qué está pasando con el ataque de Rusia a Ucrania?,La invasión de Rusia a Ucrania ha dado lugar a ataques indiscriminados contra zonas residenciales, escuelas, hospitales, infraestructuras sociales y otros objetos e infraestructuras civiles, y ha provocado muertos y heridos entre la población civil. Además, se están produciendo desplazamientos masivos y la destrucción de viviendas civiles.\nRusia también ha empleado bombas no guiadas, como las que mataron en marzo de 2022 a casi 50 personas que hacían cola para conseguir alimentos en Chernígov y armas prohibidas, como municiones de racimo, utilizadas al menos contra un jardín de infancia de Ojtirka donde se refugiaban civiles. Estos ataques pueden constituir crímenes de guerra.\nEn paralelo a la invasión de Ucrania, las autoridades rusas han desatado una oleada de represión sin precedentes en todo el país contra el periodismo independiente, las protestas contra la guerra y cualquier voz contraria a la invasión rusa de Ucrania.
¿Qué es OpenAI?,OpenAI es una organización de investigación en inteligencia artificial fundada en diciembre de 2015 por Elon Musk, Sam Altman y otros. OpenAI ha desarrollado modelos de inteligencia artificial como GPT (Generative Pre-trained Transformer), incluyendo los modelos GPT-3, GPT-3.5 y GPT-4.
